{
  "$schema": "https://ptc-runner.dev/schemas/ptc-project-config.schema.json",
  "kind": "ptc-project",
  "version": 1,
  "application": {
    "path": "01-one-question/ptc.json"
  },
  "host": {
    "path": "ptc-host.json",
    "env_file": {
      "path": ".env"
    }
  },
  "artifacts": {
    "root": "01-one-question/.ptc",
    "trace": true,
    "inspection": true,
    "result": false
  },
  "viewer": {
    "port": 4131,
    "open": true,
    "repl": true,
    "private": true
  }
}
