{
  "$schema": "https://ptc-runner.dev/schemas/ptc-project-config.schema.json",
  "kind": "ptc-project",
  "version": 1,
  "application": {"path": "reviewer.ptc.json"},
  "host": {"path": "ptc-host.reviewer-replay.json"},
  "artifacts": {
    "root": ".ptc-reviewer-replay",
    "trace": true,
    "inspection": true,
    "result": true
  },
  "viewer": {
    "port": 0,
    "open": true,
    "repl": true,
    "private": true
  }
}
